{
  "task_id": "TASK-V3-LENS-ASSUMPTION_SENSITIVITY",
  "task_type": "LENS_V3",
  "lens": "assumption_sensitivity",
  "lens_kind": "specialist",
  "paper_type": "machine_learning_method",
  "selection_reason": "selected for paper_type=machine_learning_method",
  "required_capability": "SCIENTIFIC_ASSUMPTION_REVIEW",
  "scientific_contract": "Independent Assumption Sensitivity reread. Inspect the shared paper and Lead Reader draft, but do not read other Lens outputs. Return corrections/additions, not a competing full summary.",
  "description": "Reader v3 independent specialist pass: Assumption Sensitivity.",
  "input_artifacts": {
    "source_pdf": "source/paper.pdf",
    "source_map": "model/source_map.json",
    "figure_inventory": "model/figure_inventory.json",
    "lead_reader_draft": "model/paper_understanding_draft.json"
  },
  "target_output": "lens_v3/assumption_sensitivity.json",
  "output_schema": "lens_v3",
  "source_sha256": "bdfaa68d8984f0dc02beaca527b76f207d99b666d31d1da728ee0728182df697",
  "base_sha256": "1a76e5ae80d0141406b073ef77877f092e742b764bbe44f9e86f041878ab3fd7",
  "contract_version": "3.0",
  "prompt_version": "3.0",
  "allowed_inputs": [
    "source/",
    "source_pages/",
    "assets/",
    "model/source_map.json",
    "model/figure_inventory.json",
    "model/paper_understanding_draft.json"
  ],
  "forbidden_inputs": [
    "lens/",
    "lens_v3/",
    "apply/",
    "project/",
    "memory/project/"
  ],
  "prohibited_context": [
    "other Lens outputs",
    "PROJECT_APPLY",
    "RESEARCH_MEMORY"
  ],
  "constraints": [
    "CONTEXT_ISOLATED",
    "NO_MAJORITY_VOTING",
    "NO_PROJECT_TRANSFER"
  ],
  "instructions": "Role: Assumption Sensitivity.\nAnswer only this role's scientific questions. Cite source evidence IDs/pages for every material finding.\n- Which assumptions are load-bearing?\n- Which conclusions fail or weaken if an assumption changes?\n- Which assumptions are tested versus merely asserted?\nCross-cutting checks: record a real anomaly when relevant; test a serious counterfactual/alternative explanation when relevant. Do not force either when the evidence does not support one. Use action KEEP/EXPAND/CORRECT/QUALIFY/VERIFY/NONE to tell the later editor how the Lead Reader draft should change.",
  "executor_template": {
    "host": "generic-host",
    "host_version": "UNKNOWN",
    "provider": "openai-codex",
    "model": "gpt-6.1-sol",
    "model_version": "UNKNOWN",
    "reasoning_profile": "standard",
    "tool_profile": "paper-only",
    "started_at": "2026-10-03T20:09:06.941685+00:00",
    "completed_at": "2026-10-03T20:09:06.941685+00:00"
  }
}
