{
  "task_id": "TASK-V3-VISUAL-P013",
  "task_type": "VISUAL_LOCALIZATION",
  "required_capability": "VISUAL_EVIDENCE_LOCALIZATION",
  "scientific_contract": "Inspect the full rendered PDF page and semantically bind each requested Figure/Table to its complete visual region.",
  "description": "Reader v3 semantic visual localization for source page 13.",
  "input_artifacts": {
    "source_page": "source_pages/page-013.png",
    "source_pdf": "source/paper.pdf",
    "page": 13,
    "candidates": [
      {
        "evidence_id": "F01-p13",
        "kind": "figure",
        "paper_label": "Extended Data Fig. 1",
        "caption_original": "Extended Data Fig. 1 Geographical error analysis on held-out GEDI validation data at 1 degree resolution ( ≈ 111 km on the equator). a) Root mean square",
        "candidate_bbox_pdf": [
          40.3724365234375,
          48.95989990234375,
          560.5724487304688,
          672.119873046875
        ],
        "candidate_asset": "assets/figures/fig05_p13_2168x2597.png",
        "candidate_method": "MULTIMODAL_PAGE_LOCALIZATION",
        "candidate_confidence": 1.0
      }
    ]
  },
  "target_output": "visual/page-013.json",
  "output_schema": "visual_page_verification",
  "source_sha256": "b4d103e6ab0664d96c31a00a0ee4d99e9fbc54a9f1a8eeea500716843d4eabce",
  "base_sha256": null,
  "contract_version": "3.0",
  "prompt_version": "3.0",
  "allowed_inputs": [
    "source/paper.pdf",
    "source_pages/page-013.png",
    "model/figure_inventory.json"
  ],
  "forbidden_inputs": [
    "apply/",
    "project/",
    "memory/project/",
    "lens/",
    "lens_v3/"
  ],
  "prohibited_context": [
    "PROJECT_APPLY",
    "RESEARCH_MEMORY"
  ],
  "constraints": [
    "FULL_PAGE_SEMANTIC_LOCALIZATION",
    "NO_WHOLE_PAGE_FALLBACK",
    "CAPTION_SEMANTIC_MATCH",
    "MULTI_PANEL_AWARE"
  ],
  "instructions": "Inspect the complete page image, not only PDF object geometry. For every candidate evidence_id, identify the complete visual region corresponding to its caption. Return bbox_norm=[x0,y0,x1,y1] in normalized page coordinates 0..1. A multi-panel figure should use one bbox covering the complete figure and panel_bboxes_norm for meaningful panels when identifiable. Mark VERIFIED only when the crop is complete and the caption semantically matches. Reject caption-only, body-text-heavy, partial panel, unrelated image, and whole-page regions. If uncertain, return NEEDS_REVIEW rather than guessing.",
  "executor_template": {
    "host": "generic-host",
    "host_version": "UNKNOWN",
    "provider": "magpie",
    "model": "antigravity/gemini-3.8-flash",
    "model_version": "UNKNOWN",
    "reasoning_profile": "standard",
    "tool_profile": "paper-only",
    "started_at": "2026-10-05T14:04:18.402815+00:00",
    "completed_at": "2026-10-05T14:04:18.402815+00:00"
  }
}
