{
  "task_id": "TASK-V3-LEAD-READING",
  "task_type": "LEAD_READING",
  "required_capability": "DEEP_SCIENTIFIC_READING",
  "scientific_contract": "Read the complete paper as a strong scientific reader before specialist critique. Produce a coherent open-form Paper Understanding Draft, not a schema-shaped summary.",
  "description": "Reader v3 Lead Reader full-paper understanding pass.",
  "input_artifacts": {
    "source_pdf": "source/paper.pdf",
    "source_map": "model/source_map.json",
    "figure_inventory": "model/figure_inventory.json",
    "visual_verification_dir": "visual/"
  },
  "target_output": "model/paper_understanding_draft.json",
  "output_schema": "paper_understanding_draft",
  "source_sha256": "e9a0d3128767db616085dc0f4e6e455e672e89af823e8ed1282793682787395a",
  "base_sha256": null,
  "contract_version": "3.0",
  "prompt_version": "3.0",
  "allowed_inputs": [
    "source/",
    "source_pages/",
    "assets/",
    "model/source_map.json",
    "model/figure_inventory.json",
    "visual/"
  ],
  "forbidden_inputs": [
    "lens/",
    "lens_v3/",
    "apply/",
    "project/",
    "memory/project/"
  ],
  "prohibited_context": [
    "PROJECT_APPLY",
    "RESEARCH_MEMORY",
    "prior Lens conclusions"
  ],
  "constraints": [
    "STRONG_MODEL_FIRST",
    "COMPLETE_PAPER_STORY",
    "SOURCE_GROUNDED",
    "NO_PROJECT_TRANSFER",
    "EXPLICIT_UNCERTAINTY"
  ],
  "instructions": "Read the paper as a whole. Your primary job is complete natural scientific understanding, not auditing. Begin by asking: How does this particular paper actually construct its case? Reconstruct its own paper/structure characterization and an open, ordered argument topology with source/evidence-grounded nodes and relations. Choose node roles and relations that fit this paper; observation, hypothesis, theorem, assumption, experiment, design choice, mechanism, contradiction, measurement, taxonomy branch, boundary, result and unresolved issue are examples, never a required checklist. Preserve structurally unusual forms such as proofs, taxonomies, reviews, measurement protocols, or multi-part empirical cases. Then explain the paper in natural prose, identify decisive/source-critical evidence, and record uncertainty and open issues. Do not force a problem→gap→method→experiment→result→limitation story. Do not expose internal Evidentia terminology or discuss the user's project. Classify paper_type using a concise category.",
  "executor_template": {
    "host": "generic-host",
    "host_version": "UNKNOWN",
    "provider": "openai-codex",
    "model": "gpt-6.1-sol",
    "model_version": "UNKNOWN",
    "reasoning_profile": "standard",
    "tool_profile": "paper-only",
    "started_at": "2026-10-04T02:44:10.876407+00:00",
    "completed_at": "2026-10-04T02:44:10.876407+00:00"
  }
}
