{
  "task_id": "TASK-V3-LENS-ARGUMENT_NARRATIVE",
  "task_type": "LENS_V3",
  "lens": "argument_narrative",
  "lens_kind": "core",
  "paper_type": "machine_learning",
  "selection_reason": "universal core lens",
  "required_capability": "SCIENTIFIC_ARGUMENT_RECONSTRUCTION",
  "scientific_contract": "Independent Argument & Narrative reread. Inspect the shared paper and Lead Reader draft, but do not read other Lens outputs. Return corrections/additions, not a competing full summary.",
  "description": "Reader v3 independent specialist pass: Argument & Narrative.",
  "input_artifacts": {
    "source_pdf": "source/paper.pdf",
    "source_map": "model/source_map.json",
    "figure_inventory": "model/figure_inventory.json",
    "lead_reader_draft": "model/paper_understanding_draft.json"
  },
  "target_output": "lens_v3/argument_narrative.json",
  "output_schema": "lens_v3",
  "source_sha256": "6eae057a9faf4f671c3101e0745ed704460c6d3dec77243dfd3a9f2d2ab68970",
  "base_sha256": "8b5d23e2847d89205452c786f89c83776f487e0d2a8fc741db69ce28c9bd8774",
  "contract_version": "3.0",
  "prompt_version": "3.0",
  "allowed_inputs": [
    "source/",
    "source_pages/",
    "assets/",
    "model/source_map.json",
    "model/figure_inventory.json",
    "model/paper_understanding_draft.json"
  ],
  "forbidden_inputs": [
    "lens/",
    "lens_v3/",
    "apply/",
    "project/",
    "memory/project/"
  ],
  "prohibited_context": [
    "other Lens outputs",
    "PROJECT_APPLY",
    "RESEARCH_MEMORY"
  ],
  "constraints": [
    "CONTEXT_ISOLATED",
    "NO_MAJORITY_VOTING",
    "NO_PROJECT_TRANSFER"
  ],
  "instructions": "Role: Argument & Narrative.\nAnswer only this role's scientific questions. Cite source evidence IDs/pages for every material finding.\n- How does this particular paper construct its case, in its own terms?\n- What are the paper's material claims, propositions, observations or organizing moves?\n- What ordered topology connects those nodes, and which relations are author-stated versus assessed?\n- Which important thread would be lost if this paper were forced into a conventional scientific-story outline?\n- What source evidence makes each material transition credible?\nCross-cutting checks: record a real anomaly when relevant; test a serious counterfactual/alternative explanation when relevant. Do not force either when the evidence does not support one. Use action KEEP/EXPAND/CORRECT/QUALIFY/VERIFY/NONE to tell the later editor how the Lead Reader draft should change.",
  "executor_template": {
    "host": "generic-host",
    "host_version": "UNKNOWN",
    "provider": "openai-codex",
    "model": "gpt-6.1-sol",
    "model_version": "UNKNOWN",
    "reasoning_profile": "standard",
    "tool_profile": "paper-only",
    "started_at": "2026-10-04T02:42:48.160202+00:00",
    "completed_at": "2026-10-04T02:42:48.160202+00:00"
  }
}
