{
  "task_id": "TASK-V3-LENS-VALIDITY_BOUNDARY",
  "task_type": "LENS_V3",
  "lens": "validity_boundary",
  "lens_kind": "core",
  "paper_type": "machine_learning",
  "selection_reason": "universal core lens",
  "required_capability": "SCIENTIFIC_VALIDITY_REVIEW",
  "scientific_contract": "Independent Validity & Boundary reread. Inspect the shared paper and Lead Reader draft, but do not read other Lens outputs. Return corrections/additions, not a competing full summary.",
  "description": "Reader v3 independent specialist pass: Validity & Boundary.",
  "input_artifacts": {
    "source_pdf": "source/paper.pdf",
    "source_map": "model/source_map.json",
    "figure_inventory": "model/figure_inventory.json",
    "lead_reader_draft": "model/paper_understanding_draft.json"
  },
  "target_output": "lens_v3/validity_boundary.json",
  "output_schema": "lens_v3",
  "source_sha256": "e9a0d3128767db616085dc0f4e6e455e672e89af823e8ed1282793682787395a",
  "base_sha256": "7f5377fff58ba5872ff805196eba449fa044edc91bbfec485f954b1fa212b0a9",
  "contract_version": "3.0",
  "prompt_version": "3.0",
  "allowed_inputs": [
    "source/",
    "source_pages/",
    "assets/",
    "model/source_map.json",
    "model/figure_inventory.json",
    "model/paper_understanding_draft.json"
  ],
  "forbidden_inputs": [
    "lens/",
    "lens_v3/",
    "apply/",
    "project/",
    "memory/project/"
  ],
  "prohibited_context": [
    "other Lens outputs",
    "PROJECT_APPLY",
    "RESEARCH_MEMORY"
  ],
  "constraints": [
    "CONTEXT_ISOLATED",
    "NO_MAJORITY_VOTING",
    "NO_PROJECT_TRANSFER"
  ],
  "instructions": "Role: Validity & Boundary.\nAnswer only this role's scientific questions. Cite source evidence IDs/pages for every material finding.\n- Are the paper's controls, comparisons, sampling, proof dependencies or evaluation protocols adequate for its own claims?\n- Are there confounds, leakage, unsupported generalizations or inferential jumps?\n- What alternative explanation or interpretation could fit the same evidence?\n- Which boundaries, assumptions and unresolved issues remain material?\nCross-cutting checks: record a real anomaly when relevant; test a serious counterfactual/alternative explanation when relevant. Do not force either when the evidence does not support one. Use action KEEP/EXPAND/CORRECT/QUALIFY/VERIFY/NONE to tell the later editor how the Lead Reader draft should change.",
  "executor_template": {
    "host": "generic-host",
    "host_version": "UNKNOWN",
    "provider": "openai-codex",
    "model": "gpt-6.1-sol",
    "model_version": "UNKNOWN",
    "reasoning_profile": "standard",
    "tool_profile": "paper-only",
    "started_at": "2026-10-04T02:47:20.584085+00:00",
    "completed_at": "2026-10-04T02:47:20.584085+00:00"
  }
}
